{
  "$schema": "../schemas/partcatalog.v0.1.schema.json",
  "schema_version": "0.1",
  "catalog_id": "PCAT-VIEWER-SEED-0001",
  "status": "DRAFT",
  "source_refs": [
    "viewer/shared/armor-canon.js",
    "viewer/assets/meshes/*.mesh.json",
    "docs/quest3-local-demo.md",
    "docs/uv-texture-generation-bench-log.md",
    "docs/new-route-gcp-platform-plan.md"
  ],
  "runtime_contract": {
    "mesh_format": "mesh.v1",
    "texture_binding": "SuitSpec.modules.<module>.texture_path",
    "renderer_material": "THREE.MeshStandardMaterial"
  },
  "socket_aliases": {
    "helm": "helmet",
    "torso": "chest",
    "chest_core": "chest",
    "shoulder_l": "left_shoulder",
    "shoulder_r": "right_shoulder",
    "upperarm_l": "left_upperarm",
    "upperarm_r": "right_upperarm",
    "forearm_l": "left_forearm",
    "forearm_r": "right_forearm",
    "hand_l": "left_hand",
    "hand_r": "right_hand",
    "thigh_l": "left_thigh",
    "thigh_r": "right_thigh",
    "shin_l": "left_shin",
    "shin_r": "right_shin",
    "boot_l": "left_boot",
    "boot_r": "right_boot"
  },
  "contact_pairs": [
    ["helmet", "chest"],
    ["chest", "waist"],
    ["chest", "back"],
    ["left_shoulder", "left_upperarm"],
    ["right_shoulder", "right_upperarm"],
    ["left_upperarm", "left_forearm"],
    ["right_upperarm", "right_forearm"],
    ["left_forearm", "left_hand"],
    ["right_forearm", "right_hand"],
    ["waist", "left_thigh"],
    ["waist", "right_thigh"],
    ["left_thigh", "left_shin"],
    ["right_thigh", "right_shin"],
    ["left_shin", "left_boot"],
    ["right_shin", "right_boot"]
  ],
  "material_slots": [
    {
      "slot_id": "surface_base",
      "map_types": ["base_color"],
      "suitspec_binding": "modules.<module>.texture_path",
      "renderer_binding": "MeshStandardMaterial.map",
      "required": false,
      "notes": "Current viewers expose one texture slot per module; fallback color comes from PART_COLOR_MAP."
    }
  ],
  "parts": [
    {
      "part_id": "viewer.mesh.helmet.v1",
      "module": "helmet",
      "display_name": "Helmet",
      "category": "head",
      "side": "center",
      "socket": "helmet",
      "status": "ACTIVE",
      "asset": {
        "kind": "mesh_json",
        "uri": "viewer/assets/meshes/helmet.mesh.json",
        "format": "mesh.v1",
        "mesh_name": "helmet",
        "metrics": {
          "vertices": 680,
          "triangles": 1248,
          "has_uv": true,
          "local_bbox_min": [-0.3952, -0.62, -0.37],
          "local_bbox_max": [0.3952, 0.56, 0.5]
        }
      },
      "fit": {
        "shape": "sphere",
        "source": "chest_core",
        "attach": "start",
        "offsetY": 0.2,
        "zOffset": 0.02,
        "scale": [0.3, 0.32, 0.3],
        "follow": [0.34, 0.42, 0.34],
        "minScale": [0.14, 0.16, 0.14]
      },
      "vrm_anchor": {
        "bone": "head",
        "offset": [0, 0.08, 0.12],
        "rotation": [0, 0, 0],
        "scale": [1, 1, 1]
      },
      "bone_fallbacks": ["head", "neck", "upperChest", "chest"],
      "material_slot_bindings": [
        {
          "slot_id": "surface_base",
          "binding": "module.texture_path",
          "fallback_color": "#FFCD4F"
        }
      ]
    },
    {
      "part_id": "viewer.mesh.chest.v1",
      "module": "chest",
      "display_name": "Chest",
      "category": "torso",
      "side": "center",
      "socket": "chest",
      "status": "ACTIVE",
      "asset": {
        "kind": "mesh_json",
        "uri": "viewer/assets/meshes/chest.mesh.json",
        "format": "mesh.v1",
        "mesh_name": "chest",
        "metrics": {
          "vertices": 682,
          "triangles": 1344,
          "has_uv": true,
          "local_bbox_min": [-0.534311, -0.62, 0.04],
          "local_bbox_max": [0.534311, 0.66, 0.68]
        }
      },
      "fit": {
        "shape": "box",
        "source": "chest_core",
        "attach": "center",
        "offsetY": 0,
        "zOffset": 0,
        "scale": [0.72, 0.78, 0.66],
        "follow": [0.72, 0.78, 0.72],
        "minScale": [0.48, 0.56, 0.46]
      },
      "vrm_anchor": {
        "bone": "upperChest",
        "offset": [0, 0.03, 0.1],
        "rotation": [0, 0, 0],
        "scale": [1, 1, 1]
      },
      "bone_fallbacks": ["upperChest", "chest", "spine", "hips"],
      "material_slot_bindings": [
        {
          "slot_id": "surface_base",
          "binding": "module.texture_path",
          "fallback_color": "#4FA8FF"
        }
      ]
    },
    {
      "part_id": "viewer.mesh.back.v1",
      "module": "back",
      "display_name": "Back",
      "category": "dorsal",
      "side": "center",
      "socket": "back",
      "status": "ACTIVE",
      "asset": {
        "kind": "mesh_json",
        "uri": "viewer/assets/meshes/back.mesh.json",
        "format": "mesh.v1",
        "mesh_name": "back",
        "metrics": {
          "vertices": 597,
          "triangles": 1176,
          "has_uv": true,
          "local_bbox_min": [-0.452889, -0.6, -0.6],
          "local_bbox_max": [0.452889, 0.58, -0.06]
        }
      },
      "fit": {
        "shape": "box",
        "source": "chest_core",
        "attach": "center",
        "offsetY": -0.02,
        "zOffset": -0.1,
        "scale": [0.68, 0.74, 0.6],
        "follow": [0.68, 0.76, 0.68],
        "minScale": [0.18, 0.12, 0.14]
      },
      "vrm_anchor": {
        "bone": "upperChest",
        "offset": [0, 0.01, -0.1],
        "rotation": [0, 180, 0],
        "scale": [1, 1, 1]
      },
      "bone_fallbacks": ["upperChest", "chest", "spine"],
      "material_slot_bindings": [
        {
          "slot_id": "surface_base",
          "binding": "module.texture_path",
          "fallback_color": "#4F88E8"
        }
      ]
    },
    {
      "part_id": "viewer.mesh.waist.v1",
      "module": "waist",
      "display_name": "Waist",
      "category": "waist",
      "side": "center",
      "socket": "waist",
      "status": "ACTIVE",
      "asset": {
        "kind": "mesh_json",
        "uri": "viewer/assets/meshes/waist.mesh.json",
        "format": "mesh.v1",
        "mesh_name": "waist",
        "metrics": {
          "vertices": 486,
          "triangles": 800,
          "has_uv": true,
          "local_bbox_min": [-0.4601, -0.38, -0.4],
          "local_bbox_max": [0.4601, 0.36, 0.43]
        }
      },
      "fit": {
        "shape": "box",
        "source": "chest_core",
        "attach": "end",
        "offsetY": -0.08,
        "zOffset": 0,
        "scale": [0.52, 0.38, 0.46],
        "follow": [0.62, 0.7, 0.62],
        "minScale": [0.14, 0.1, 0.12]
      },
      "vrm_anchor": {
        "bone": "hips",
        "offset": [0, 0, 0.06],
        "rotation": [0, 0, 0],
        "scale": [1, 1, 1]
      },
      "bone_fallbacks": ["hips", "spine"],
      "material_slot_bindings": [
        {
          "slot_id": "surface_base",
          "binding": "module.texture_path",
          "fallback_color": "#62C9FF"
        }
      ]
    },
    {
      "part_id": "viewer.mesh.left_shoulder.v1",
      "module": "left_shoulder",
      "display_name": "Left Shoulder",
      "category": "shoulder",
      "side": "left",
      "socket": "left_shoulder",
      "status": "ACTIVE",
      "asset": {
        "kind": "mesh_json",
        "uri": "viewer/assets/meshes/left_shoulder.mesh.json",
        "format": "mesh.v1",
        "mesh_name": "left_shoulder",
        "metrics": {
          "vertices": 326,
          "triangles": 576,
          "has_uv": true,
          "local_bbox_min": [-0.324, -0.25, -0.3],
          "local_bbox_max": [0.324, 0.24, 0.34]
        }
      },
      "fit": {
        "shape": "sphere",
        "source": "left_upperarm",
        "attach": "start",
        "offsetY": 0.08,
        "zOffset": 0,
        "scale": [0.24, 0.24, 0.24],
        "follow": [0.56, 0.5, 0.56],
        "minScale": [0.16, 0.16, 0.16]
      },
      "vrm_anchor": {
        "bone": "leftShoulder",
        "offset": [0.02, 0.02, 0.02],
        "rotation": [0, 0, 0],
        "scale": [1, 1, 1]
      },
      "bone_fallbacks": ["leftShoulder", "leftUpperArm", "upperChest", "chest"],
      "material_slot_bindings": [
        {
          "slot_id": "surface_base",
          "binding": "module.texture_path",
          "fallback_color": "#FF8F6A"
        }
      ]
    },
    {
      "part_id": "viewer.mesh.right_shoulder.v1",
      "module": "right_shoulder",
      "display_name": "Right Shoulder",
      "category": "shoulder",
      "side": "right",
      "socket": "right_shoulder",
      "status": "ACTIVE",
      "asset": {
        "kind": "mesh_json",
        "uri": "viewer/assets/meshes/right_shoulder.mesh.json",
        "format": "mesh.v1",
        "mesh_name": "right_shoulder",
        "metrics": {
          "vertices": 326,
          "triangles": 576,
          "has_uv": true,
          "local_bbox_min": [-0.324, -0.25, -0.3],
          "local_bbox_max": [0.324, 0.24, 0.34]
        }
      },
      "fit": {
        "shape": "sphere",
        "source": "right_upperarm",
        "attach": "start",
        "offsetY": 0.08,
        "zOffset": 0,
        "scale": [0.24, 0.24, 0.24],
        "follow": [0.56, 0.5, 0.56],
        "minScale": [0.16, 0.16, 0.16]
      },
      "vrm_anchor": {
        "bone": "rightShoulder",
        "offset": [-0.02, 0.02, 0.02],
        "rotation": [0, 0, 0],
        "scale": [1, 1, 1]
      },
      "bone_fallbacks": ["rightShoulder", "rightUpperArm", "upperChest", "chest"],
      "material_slot_bindings": [
        {
          "slot_id": "surface_base",
          "binding": "module.texture_path",
          "fallback_color": "#FF6A8F"
        }
      ]
    },
    {
      "part_id": "viewer.mesh.left_upperarm.v1",
      "module": "left_upperarm",
      "display_name": "Left Upper Arm",
      "category": "upper_arm",
      "side": "left",
      "socket": "left_upperarm",
      "status": "ACTIVE",
      "asset": {
        "kind": "mesh_json",